{
  "version": "0.2.0",
  "run_id": "pkt-dome-demo-0001",
  "task_id": "wave-gate",
  "status": "APPROVE",
  "reason_codes": [],
  "confidence": 0.9,
  "risk_score": 20,
  "notes": [
    "all deterministic checks passed",
    "trace_source=disabled",
    "verify_rc=0",
    "verify_output=demo verify ok"
  ],
  "telemetry_ref": {
    "trace_id_hex": "b7301565972a696944cbf0a45990bdd4",
    "span_id_hex": "b78e8e779231dc6c"
  }
}